Symbol,Name,Last Sale,Net Change,% Change,Market Cap,Country,IPO Year,Volume,Sector,Industry
PW,Power REIT (MD) Common Stock,$47.935,1.485,3.197%,158148734.00,United States,,14073,Consumer Services,Real Estate Investment Trusts
PW^A,Power REIT 7.75% Series A Cumulative Perpetual Preferred Stock,$26.30,0.00,0.00%,,United States,,6,,
PZG,Paramount Gold Nevada Corp. Common Stock,$1.0499,0.0199,1.932%,38034251.00,United States,2015,42379,Basic Industries,Precious Metals
RCG,RENN Fund Inc Common Stock,$2.7201,0.0195,0.722%,16189916.00,United States,,7500,,
REI,Ring Energy Inc. Common Stock,$2.22,0.16,7.767%,220183123.00,United States,,1884565,Energy,Oil & Gas Production
REPX,Riley Exploration Permian Inc. Common Stock,$33.16,-0.38,-1.133%,597593670.00,United States,,26227,Energy,Oil & Gas Production
RHE,Regional Health Properties Inc. Common Stock,$4.50,0.10,2.273%,7596986.00,,2017,48768,Health Care,Hospital/Nursing Management
RHE^A,Regional Health Properties Inc. 10.875% Series A Cumulative Redeemable Preferred Stock,$2.80,-0.03,-1.06%,,,,1900,,
RLGT,Radiant Logistics Inc. Common Stock,$6.70,0.01,0.149%,334782511.00,United States,,87534,Transportation,Oil Refining/Marketing
RMED,Ra Medical Systems Inc. Common Stock,$4.15,-0.13,-3.037%,13512317.00,,2018,53897,Health Care,Medical/Dental Instruments
RVP,Retractable Technologies Inc. Common Stock,$10.77,0.00,0.00%,365992645.00,United States,,173464,Health Care,Medical/Dental Instruments
SACC,Sachem Capital Corp. 6.875% Notes due 2024,$25.40,0.02,0.079%,0.00,United States,2019,745,Consumer Services,Real Estate Investment Trusts
SACH,Sachem Capital Corp. Common Shares,$5.142,-0.078,-1.494%,114709119.00,United States,2017,169132,Consumer Services,Real Estate Investment Trusts
SCCB,Sachem Capital Corp. 7.125% Notes due 2024,$25.55,0.00,0.00%,0.00,United States,2019,29,Consumer Services,Real Estate Investment Trusts
SCCC,Sachem Capital Corp. 7.75% Notes due 2025,$25.7889,0.0389,0.151%,0.00,United States,2020,2039,Consumer Services,Real Estate Investment Trusts
SDPI,Superior Drilling Products Inc. Common Stock,$0.8616,0.0214,2.547%,22196834.00,,2014,26399,Energy,Metal Fabrications
SEB,Seaboard Corporation Common Stock,$3585.1793,-14.6507,-0.407%,4161600843.00,United States,1996,229,,
SENS,Senseonics Holdings Inc. Common Stock,$2.1818,0.0818,3.895%,933624912.00,United States,,8193926,Health Care,Medical Specialities
SIF,SIFCO Industries Inc. Common Stock,$14.04,-0.38,-2.635%,83667575.00,United States,,11591,Capital Goods,Office Equipment/Supplies/Services
SILV,SilverCrest Metals Inc. Common Shares,$8.87,0.05,0.567%,1281342141.00,,2018,273347,Capital Goods,Industrial Machinery/Components
SIM,Grupo Simec S.A.B. de C.V. American Depositary Shares,$13.8835,-0.6165,-4.252%,2303315286.00,Mexico,1993,1173,Basic Industries,Steel/Iron Ore
SMTS,Sierra Metals Inc. Common Stock,$3.6586,0.0886,2.482%,595658689.00,,,480287,Basic Industries,Precious Metals
SNMP,Evolve Transition Infrastructure LP Common Stock,$0.75,-0.01,-1.316%,42139034.00,United States,,176446,Energy,Oil & Gas Production
SSY,SunLink Health Systems Inc. Common Stock,$2.1593,-0.0307,-1.402%,14897704.00,United States,,42109,Health Care,Medical/Nursing Services
STXS,Stereotaxis Inc. Common Stock,$7.53,-0.13,-1.697%,557826007.00,United States,,88594,Health Care,Biotechnology: Electromedical & Electrotherapeutic Apparatus
SVM,Silvercorp Metals Inc. Common Shares,$5.37,0.06,1.13%,941673598.00,,,459164,,
SVT,Servotronics Inc. Common Stock,$7.98,0.00,0.00%,19778486.00,United States,,47,Consumer Durables,Metal Fabrications
SYN,Synthetic Biologics Inc. Common Stock,$0.6164,0.0216,3.631%,79919080.00,United States,,1503267,Health Care,Major Pharmaceuticals
TGB,Taseko Mines Ltd. Common Stock,$2.01,0.00,0.00%,569065218.00,Canada,,1583499,,
THM,International Tower Hill Mines Ltd. Ordinary Shares (Canada),$1.075,0.015,1.415%,209526298.00,Canada,,57576,,
TKAT,Takung Art Co. Ltd. Common Stock,$32.04,0.24,0.755%,361134983.00,,,1512647,Consumer Services,Catalog/Specialty Distribution
TMBR,Timber Pharmaceuticals Inc. Common Stock,$1.62,0.00,0.00%,59388690.00,United States,2015,521491,Consumer Durables,Specialty Chemicals
TMP,Tompkins Financial Corporation Common Stock,$78.31,-0.04,-0.051%,1167345556.00,United States,,7273,Finance,Major Banks
TMQ,Trilogy Metals Inc. Common Stock,$2.2622,-0.0278,-1.214%,326419113.00,Canada,,43857,,
TPHS,Trinity Place Holdings Inc. Common Stock,$1.99,-0.02,-0.995%,64560844.00,,,4252,Consumer Services,Real Estate
TRT,Trio-Tech International Common Stock,$4.611,-0.089,-1.894%,17109369.00,United States,,12376,Technology,Industrial Machinery/Components
TRX,Tanzanian Gold Corporation Common Stock,$0.5722,-0.0036,-0.625%,145836932.00,Canada,,638370,,
UAMY,United States Antimony Corporation Common Stock,$0.9355,0.0099,1.07%,96169494.00,United States,,773420,,
UAVS,AgEagle Aerial Systems Inc. Common Stock,$6.0499,-0.3301,-5.174%,378032932.00,United States,,1858083,,
UEC,Uranium Energy Corp. Common Stock,$3.015,0.215,7.679%,695029085.00,Canada,,2670418,Basic Industries,Other Metals and Minerals
UFAB,Unique Fabricating Inc. Common Stock,$4.4535,-0.0865,-1.905%,43551431.00,United States,2015,2247,Capital Goods,Auto Parts:O.E.M.
URG,Ur Energy Inc Common Shares (Canada),$1.115,0.035,3.241%,211168847.00,Canada,,996914,,
USAS,Americas Gold and Silver Corporation Common Shares no par value,$2.2225,-0.0175,-0.781%,295684625.00,,2017,176084,,
UTG,Reaves Utility Income Fund Common Shares of Beneficial Interest,$34.3037,-0.1163,-0.338%,1910611121.00,United States,2004,87430,,
UUU,Universal Security Instruments Inc. Common Stock,$5.79,0.04,0.696%,13391616.00,United States,,7688,Miscellaneous,Diversified Manufacture
UUUU,Energy Fuels Inc Ordinary Shares (Canada),$5.6464,0.2364,4.37%,801236294.00,,,1906204,,
VCF,Delaware Investments Colorado Municipal Income Fund Inc  Common Stock,$14.38,0.00,0.00%,69557498.00,United States,1993,193,,
VFL,Delaware Investments National Municipal Income Fund Common Stock,$13.51,0.03,0.223%,61179265.00,United States,1993,4252,,
VGZ,Vista Gold Corp Common Stock,$1.08,-0.01,-0.917%,112102837.00,United States,,68096,,
VHAQ,Viveon Health Acquisition Corp. Common Stock,$9.94,0.05,0.506%,250053125.00,,2021,8056,,
VKI,Invesco Advantage Municipal Income Trust II Common Shares of Beneficial Interest (DE),$12.14,-0.0197,-0.162%,538913429.00,United States,,97700,,
VMM,Delaware Investments Minnesota Municipal Income Fund II Inc. Common Stock,$13.54,0.07,0.52%,155777362.00,United States,1993,5002,,
VNRX,VolitionRX Limited Common Stock,$3.27,-0.04,-1.208%,172887866.00,Singapore,2015,115482,Health Care,Biotechnology: Biological Products (No Diagnostic Substances)
VOLT,Volt Information Sciences Inc. Common Stock,$3.98,0.09,2.314%,86511569.00,United States,,39584,Technology,Diversified Commercial Services
WLMS,Williams Industrial Services Group Inc. Common Stock,$5.2353,0.0553,1.068%,133938423.00,,2021,143022,Capital Goods,Oilfield Services/Equipment
WRN,Western Copper and Gold Corporation Common Stock,$1.50,0.01,0.671%,203696453.00,Canada,2011,333348,,
WTT,Wireless Telecom Group  Inc. Common Stock,$1.955,0.045,2.356%,42377556.00,United States,,19626,Capital Goods,Telecommunications Equipment
WWR,Westwater Resources Inc. Common Stock,$4.6084,0.1184,2.637%,149018674.00,United States,,527249,Basic Industries,Other Metals and Minerals
WYY,WidePoint Corporation Common Stock,$8.88,0.08,0.909%,79872945.00,United States,,28600,Technology,EDP Services
XPL,Solitario Zinc Corp. Common Stock,$0.747,0.0125,1.702%,43609200.00,United States,,337281,,
XTNT,Xtant Medical Holdings Inc. Common Stock,$1.98,-0.01,-0.503%,171680426.00,United States,,51727,Health Care,Medical Specialities
XXII,22nd Century Group Inc. Common Stock,$5.63,0.72,14.664%,857997931.00,United States,,8632363,,
YCBD,cbdMD Inc. Common Stock,$3.82,0.01,0.262%,212528118.00,United States,2017,114590,Health Care,Major Pharmaceuticals
YCBD^A,cbdMD Inc. 8.0% Series A Cumulative Convertible Preferred Stock,$9.23,0.00,0.00%,,United States,,105,,
ZDGE,Zedge Inc. Class B Common Stock ,$14.50,0.00,0.00%,196209665.00,,2016,145739,Technology,Computer Software: Prepackaged Software
ZOM,Zomedica Corp. Common Shares,$1.1007,0.0007,0.064%,1069899451.00,United States,2017,26684282,,
